{
  "schema_version": "1.0.0",
  "policy_version": "1.0.0",
  "run_id": "polyglot-vscode-23329272460-1",
  "repo": "mcp-tool-shop-org/polyglot-vscode",
  "ref": {
    "branch": "main",
    "commit_sha": "ebc1c852e599c148599692ad4bd0fe8b426cc162"
  },
  "source": {
    "actor": "mcp-tool-shop",
    "attempt": 1,
    "provider": "github",
    "provider_run_id": "23329272460",
    "run_url": "https://github.com/mcp-tool-shop-org/polyglot-vscode/actions/runs/23329272460",
    "workflow": "dogfood.yml"
  },
  "timing": {
    "duration_ms": 0,
    "finished_at": "2026-03-20T04:37:25Z",
    "started_at": "2026-03-20T00:36:22-04:00"
  },
  "ci_checks": [],
  "scenario_results": [
    {
      "evidence": [
        {
          "description": "CI run log with extension build and test output",
          "kind": "log",
          "url": "https://github.com/mcp-tool-shop-org/polyglot-vscode/actions/runs/23329272460"
        }
      ],
      "execution_mode": "bot",
      "notes": "Bot-driven VS Code extension build and test verification",
      "product_surface": "plugin",
      "scenario_id": "build-and-test-extension",
      "scenario_name": "Build VS Code extension and run tests",
      "scenario_version": "1.0.0",
      "step_results": [
        {
          "status": "pass",
          "step_id": "build-extension"
        },
        {
          "status": "pass",
          "step_id": "run-tests"
        },
        {
          "status": "pass",
          "step_id": "verify-output"
        }
      ],
      "verdict": "pass"
    }
  ],
  "overall_verdict": {
    "proposed": "pass",
    "verified": "pass",
    "downgraded": false
  },
  "verification": {
    "status": "accepted",
    "verified_at": "2026-03-20T04:37:38.033Z",
    "provenance_confirmed": true,
    "schema_valid": true,
    "policy_valid": true,
    "rejection_reasons": []
  },
  "notes": "Expansion: polyglot-vscode plugin surface dogfood."
}
