{
  "schema_version": "1.0.0",
  "policy_version": "1.0.0",
  "run_id": "shipcheck-23326132347-1",
  "repo": "mcp-tool-shop-org/shipcheck",
  "ref": {
    "branch": "main",
    "commit_sha": "7aadb94e65095822b062474f38c5273199d69b4f"
  },
  "source": {
    "actor": "mcp-tool-shop",
    "attempt": 1,
    "provider": "github",
    "provider_run_id": "23326132347",
    "run_url": "https://github.com/mcp-tool-shop-org/shipcheck/actions/runs/23326132347",
    "workflow": "ci.yml"
  },
  "timing": {
    "duration_ms": 0,
    "finished_at": "2026-03-20T02:11:04Z",
    "started_at": "2026-03-19T22:10:31-04:00"
  },
  "ci_checks": [
    {
      "id": "unit-tests",
      "kind": "test",
      "status": "pass",
      "value": 24
    }
  ],
  "scenario_results": [
    {
      "evidence": [
        {
          "description": "CI run log with audit output",
          "kind": "log",
          "url": "https://github.com/mcp-tool-shop-org/shipcheck/actions/runs/23326132347"
        },
        {
          "description": "Audit log artifact (dogfood-audit-log)",
          "kind": "artifact",
          "url": "https://github.com/mcp-tool-shop-org/shipcheck/actions/runs/23326132347/artifacts"
        }
      ],
      "execution_mode": "bot",
      "notes": "Self-gate audit exit code: 0",
      "product_surface": "cli",
      "scenario_id": "self-gate-real-repo",
      "scenario_name": "Self-gate against real repo",
      "scenario_version": "1.0.0",
      "step_results": [
        {
          "status": "pass",
          "step_id": "run-help"
        },
        {
          "status": "pass",
          "step_id": "run-init"
        },
        {
          "status": "pass",
          "step_id": "run-audit"
        },
        {
          "status": "pass",
          "step_id": "verify-output"
        }
      ],
      "verdict": "pass"
    }
  ],
  "overall_verdict": {
    "proposed": "pass",
    "verified": "pass",
    "downgraded": false
  },
  "verification": {
    "status": "accepted",
    "verified_at": "2026-03-20T02:11:17.099Z",
    "provenance_confirmed": true,
    "schema_valid": true,
    "policy_valid": true,
    "rejection_reasons": []
  },
  "notes": "Pilot 1: shipcheck self-dogfood."
}
