{
  "schema_version": "1.0.0",
  "policy_version": "1.0.0",
  "run_id": "claude-guardian-23326623878-1",
  "repo": "mcp-tool-shop-org/claude-guardian",
  "ref": {
    "branch": "main",
    "commit_sha": "ec7814becdaf14c5d9a667f44ee4ab9293b59a7a"
  },
  "source": {
    "actor": "mcp-tool-shop",
    "attempt": 1,
    "provider": "github",
    "provider_run_id": "23326623878",
    "run_url": "https://github.com/mcp-tool-shop-org/claude-guardian/actions/runs/23326623878",
    "workflow": "dogfood.yml"
  },
  "timing": {
    "duration_ms": 0,
    "finished_at": "2026-03-20T02:33:43Z",
    "started_at": "2026-03-19T22:32:52-04:00"
  },
  "ci_checks": [],
  "scenario_results": [
    {
      "evidence": [
        {
          "description": "CI run log with status + preflight output",
          "kind": "log",
          "url": "https://github.com/mcp-tool-shop-org/claude-guardian/actions/runs/23326623878"
        }
      ],
      "execution_mode": "bot",
      "notes": "Bot-driven status + preflight roundtrip",
      "product_surface": "mcp-server",
      "scenario_id": "status-preflight-roundtrip",
      "scenario_name": "Run status + preflight on mock project",
      "scenario_version": "1.0.0",
      "step_results": [
        {
          "status": "pass",
          "step_id": "run-status"
        },
        {
          "status": "pass",
          "step_id": "run-preflight"
        },
        {
          "status": "pass",
          "step_id": "verify-output"
        }
      ],
      "verdict": "pass"
    }
  ],
  "overall_verdict": {
    "proposed": "pass",
    "verified": "pass",
    "downgraded": false
  },
  "verification": {
    "status": "accepted",
    "verified_at": "2026-03-20T02:33:54.237Z",
    "provenance_confirmed": true,
    "schema_valid": true,
    "policy_valid": true,
    "rejection_reasons": []
  },
  "notes": "Phase 2 rollout: claude-guardian MCP dogfood."
}
