{
  "schema_version": "1.0.0",
  "policy_version": "1.0.0",
  "run_id": "repo-crawler-mcp-23326627220-1",
  "repo": "mcp-tool-shop-org/repo-crawler-mcp",
  "ref": {
    "branch": "main",
    "commit_sha": "78adc1dd1e0de7394292219175e8013ff0d91391"
  },
  "source": {
    "actor": "mcp-tool-shop",
    "attempt": 1,
    "provider": "github",
    "provider_run_id": "23326627220",
    "run_url": "https://github.com/mcp-tool-shop-org/repo-crawler-mcp/actions/runs/23326627220",
    "workflow": "dogfood.yml"
  },
  "timing": {
    "duration_ms": 0,
    "finished_at": "2026-03-20T02:33:58Z",
    "started_at": "2026-03-19T22:33:32-04:00"
  },
  "ci_checks": [],
  "scenario_results": [
    {
      "evidence": [
        {
          "description": "CI run log with crawl output",
          "kind": "log",
          "url": "https://github.com/mcp-tool-shop-org/repo-crawler-mcp/actions/runs/23326627220"
        }
      ],
      "execution_mode": "bot",
      "notes": "Bot-driven crawl of mcp-tool-shop-org/shipcheck",
      "product_surface": "mcp-server",
      "scenario_id": "crawl-real-repo",
      "scenario_name": "Start MCP server and verify initialization",
      "scenario_version": "1.0.0",
      "step_results": [
        {
          "status": "pass",
          "step_id": "server-start"
        },
        {
          "status": "pass",
          "step_id": "crawl-via-stdio"
        },
        {
          "status": "pass",
          "step_id": "verify-output"
        }
      ],
      "verdict": "pass"
    }
  ],
  "overall_verdict": {
    "proposed": "pass",
    "verified": "pass",
    "downgraded": false
  },
  "verification": {
    "status": "accepted",
    "verified_at": "2026-03-20T02:34:08.015Z",
    "provenance_confirmed": true,
    "schema_valid": true,
    "policy_valid": true,
    "rejection_reasons": []
  },
  "notes": "Phase 2 rollout: repo-crawler-mcp dogfood."
}
