{
  "schema_version": "1.0.0",
  "policy_version": "1.0.0",
  "run_id": "ai-loadout-23326630420-1",
  "repo": "mcp-tool-shop-org/ai-loadout",
  "ref": {
    "branch": "main",
    "commit_sha": "41c7ba0c7d81f9a4131fc3065a45eb2263d252cb"
  },
  "source": {
    "actor": "mcp-tool-shop",
    "attempt": 1,
    "provider": "github",
    "provider_run_id": "23326630420",
    "run_url": "https://github.com/mcp-tool-shop-org/ai-loadout/actions/runs/23326630420",
    "workflow": "dogfood.yml"
  },
  "timing": {
    "duration_ms": 0,
    "finished_at": "2026-03-20T02:33:59Z",
    "started_at": "2026-03-19T22:33:41-04:00"
  },
  "ci_checks": [],
  "scenario_results": [
    {
      "evidence": [
        {
          "description": "CI run log with resolve output",
          "kind": "log",
          "url": "https://github.com/mcp-tool-shop-org/ai-loadout/actions/runs/23326630420"
        }
      ],
      "execution_mode": "bot",
      "notes": "Bot-driven resolve against test dispatch table",
      "product_surface": "cli",
      "scenario_id": "resolve-real-loadout",
      "scenario_name": "Resolve a loadout from a dispatch table",
      "scenario_version": "1.0.0",
      "step_results": [
        {
          "status": "pass",
          "step_id": "create-project-index"
        },
        {
          "status": "pass",
          "step_id": "resolve-loadout"
        },
        {
          "status": "pass",
          "step_id": "verify-output"
        }
      ],
      "verdict": "pass"
    }
  ],
  "overall_verdict": {
    "proposed": "pass",
    "verified": "pass",
    "downgraded": false
  },
  "verification": {
    "status": "accepted",
    "verified_at": "2026-03-20T02:34:22.988Z",
    "provenance_confirmed": true,
    "schema_valid": true,
    "policy_valid": true,
    "rejection_reasons": []
  },
  "notes": "Phase 2 rollout: ai-loadout CLI dogfood."
}
