{
  "schema_version": "1.0.0",
  "policy_version": "1.0.0",
  "run_id": "zip-meta-map-23328698294-1",
  "repo": "mcp-tool-shop-org/zip-meta-map",
  "ref": {
    "branch": "main",
    "commit_sha": "bd5b7c135ceece624cb30bcfa11ef3158dcd58da"
  },
  "source": {
    "actor": "mcp-tool-shop",
    "attempt": 1,
    "provider": "github",
    "provider_run_id": "23328698294",
    "run_url": "https://github.com/mcp-tool-shop-org/zip-meta-map/actions/runs/23328698294",
    "workflow": "dogfood.yml"
  },
  "timing": {
    "duration_ms": 0,
    "finished_at": "2026-03-20T04:10:38Z",
    "started_at": "2026-03-20T00:10:12-04:00"
  },
  "ci_checks": [],
  "scenario_results": [
    {
      "evidence": [
        {
          "description": "CI run log with profile output",
          "kind": "log",
          "url": "https://github.com/mcp-tool-shop-org/zip-meta-map/actions/runs/23328698294"
        }
      ],
      "execution_mode": "bot",
      "notes": "Bot-driven profile of the repo itself",
      "product_surface": "cli",
      "scenario_id": "profile-real-repo",
      "scenario_name": "Profile the repo itself and verify output",
      "scenario_version": "1.0.0",
      "step_results": [
        {
          "status": "fail",
          "step_id": "profile-self"
        },
        {
          "status": "fail",
          "step_id": "verify-output"
        }
      ],
      "verdict": "fail"
    }
  ],
  "overall_verdict": {
    "proposed": "fail",
    "verified": "fail",
    "downgraded": false
  },
  "verification": {
    "status": "accepted",
    "verified_at": "2026-03-20T04:11:00.397Z",
    "provenance_confirmed": true,
    "schema_valid": true,
    "policy_valid": true,
    "rejection_reasons": []
  },
  "notes": "Phase 2 rollout: zip-meta-map CLI dogfood."
}
