{
  "schema_version": "1.0.0",
  "policy_version": "1.0.0",
  "run_id": "ai-loadout-23326498651-1",
  "repo": "mcp-tool-shop-org/ai-loadout",
  "ref": {
    "branch": "main",
    "commit_sha": "bfa9af319d0d5dab16f085ba7d4ebb0e30f99b70"
  },
  "source": {
    "actor": "mcp-tool-shop",
    "attempt": 1,
    "provider": "github",
    "provider_run_id": "23326498651",
    "run_url": "https://github.com/mcp-tool-shop-org/ai-loadout/actions/runs/23326498651",
    "workflow": "dogfood.yml"
  },
  "timing": {
    "duration_ms": 0,
    "finished_at": "2026-03-20T02:27:52Z",
    "started_at": "2026-03-20T02:25:10Z"
  },
  "ci_checks": [],
  "scenario_results": [
    {
      "evidence": [
        {
          "description": "CI run log with resolve output",
          "kind": "log",
          "url": "https://github.com/mcp-tool-shop-org/ai-loadout/actions/runs/23326498651"
        }
      ],
      "execution_mode": "bot",
      "notes": "Bot-driven resolve against test dispatch table",
      "product_surface": "cli",
      "scenario_id": "resolve-real-loadout",
      "scenario_name": "Resolve a loadout from a dispatch table",
      "scenario_version": "1.0.0",
      "step_results": [
        {
          "status": "pass",
          "step_id": "create-dispatch-table"
        },
        {
          "status": "pass",
          "step_id": "resolve-loadout"
        },
        {
          "status": "fail",
          "step_id": "verify-output"
        }
      ],
      "verdict": "fail"
    }
  ],
  "overall_verdict": {
    "proposed": "fail",
    "verified": "fail",
    "downgraded": false
  },
  "verification": {
    "status": "accepted",
    "verified_at": "2026-03-20T02:28:04.100Z",
    "provenance_confirmed": true,
    "schema_valid": true,
    "policy_valid": true,
    "rejection_reasons": []
  },
  "notes": "Phase 2 rollout: ai-loadout CLI dogfood."
}
