{
  "schema_version": "1.0.0",
  "policy_version": "1.0.0",
  "run_id": "a11y-demo-site-23329256169-1",
  "repo": "mcp-tool-shop-org/a11y-demo-site",
  "ref": {
    "branch": "main",
    "commit_sha": "855201a4d4dd32d7c56842336fbf336a7334d0f6"
  },
  "source": {
    "actor": "mcp-tool-shop",
    "attempt": 1,
    "provider": "github",
    "provider_run_id": "23329256169",
    "run_url": "https://github.com/mcp-tool-shop-org/a11y-demo-site/actions/runs/23329256169",
    "workflow": "dogfood.yml"
  },
  "timing": {
    "duration_ms": 0,
    "finished_at": "2026-03-20T04:36:38Z",
    "started_at": "2026-03-20T00:36:13-04:00"
  },
  "ci_checks": [],
  "scenario_results": [
    {
      "evidence": [
        {
          "description": "CI run log with Astro build output",
          "kind": "log",
          "url": "https://github.com/mcp-tool-shop-org/a11y-demo-site/actions/runs/23329256169"
        }
      ],
      "execution_mode": "bot",
      "notes": "Bot-driven Astro site build and output verification",
      "product_surface": "web",
      "scenario_id": "build-and-verify-site",
      "scenario_name": "Build Astro site and verify output",
      "scenario_version": "1.0.0",
      "step_results": [
        {
          "status": "pass",
          "step_id": "build-site"
        },
        {
          "status": "pass",
          "step_id": "verify-output"
        }
      ],
      "verdict": "pass"
    }
  ],
  "overall_verdict": {
    "proposed": "pass",
    "verified": "pass",
    "downgraded": false
  },
  "verification": {
    "status": "accepted",
    "verified_at": "2026-03-20T04:36:49.776Z",
    "provenance_confirmed": true,
    "schema_valid": true,
    "policy_valid": true,
    "rejection_reasons": []
  },
  "notes": "Expansion: a11y-demo-site web surface dogfood."
}
