{
  "schema_version": "1.0.0",
  "policy_version": "1.0.0",
  "run_id": "site-theme-23328691331-1",
  "repo": "mcp-tool-shop-org/site-theme",
  "ref": {
    "branch": "main",
    "commit_sha": "ed79a8e34143d2fa5ae1d3e82562c53886dd7da6"
  },
  "source": {
    "actor": "mcp-tool-shop",
    "attempt": 1,
    "provider": "github",
    "provider_run_id": "23328691331",
    "run_url": "https://github.com/mcp-tool-shop-org/site-theme/actions/runs/23328691331",
    "workflow": "dogfood.yml"
  },
  "timing": {
    "duration_ms": 0,
    "finished_at": "2026-03-20T04:10:21Z",
    "started_at": "2026-03-20T00:10:03-04:00"
  },
  "ci_checks": [],
  "scenario_results": [
    {
      "evidence": [
        {
          "description": "CI run log with scaffold and template list output",
          "kind": "log",
          "url": "https://github.com/mcp-tool-shop-org/site-theme/actions/runs/23328691331"
        }
      ],
      "execution_mode": "bot",
      "notes": "Bot-driven scaffold dry-run and template listing",
      "product_surface": "npm-package",
      "scenario_id": "scaffold-and-verify",
      "scenario_name": "Scaffold template and verify CLI outputs",
      "scenario_version": "1.0.0",
      "step_results": [
        {
          "status": "pass",
          "step_id": "scaffold-template"
        },
        {
          "status": "pass",
          "step_id": "list-templates"
        },
        {
          "status": "pass",
          "step_id": "verify-output"
        }
      ],
      "verdict": "pass"
    }
  ],
  "overall_verdict": {
    "proposed": "pass",
    "verified": "pass",
    "downgraded": false
  },
  "verification": {
    "status": "accepted",
    "verified_at": "2026-03-20T04:10:44.593Z",
    "provenance_confirmed": true,
    "schema_valid": true,
    "policy_valid": true,
    "rejection_reasons": []
  },
  "notes": "site-theme CLI dogfood: scaffold-and-verify scenario."
}
